{
  "intent_id": "i7",
  "intent_revision": 1,
  "quote_id": "qt1",
  "quote_revision": "1",
  "session": "s_checkout_1",
  "ref": {
    "publisher": "https://shop.example",
    "namespace": "addp",
    "id": "https://shop.example/addp/resources/o17"
  },
  "quantity": 1,
  "total": {
    "amount_minor": 33399,
    "currency": "EUR"
  },
  "capability_digest": "4f47a5fea0d7ad71540ff2d7f0c5d1f4bcbda629057e9837b6c02aab98be2c38"
}
